id,trivia_true,source,media
1,"""Over Each Other"" adalah satu-satunya lagu dalam album ""From Zero"" yang hanya dinyanyikan oleh Emily tanpa iringan vokal dari personil lainnya ",,https://img.youtube.com/vi/fSHoePrnmMw/hqdefault.jpg
2,"Desain soldier pada sampul album Hybrid Theory digambar oleh Mike Shinoda, dan gambar sayap capung ditambahkan oleh Frank Maddocks",https://linkinpedia.com/wiki/Hybrid_Theory,https://linkinpedia.com/w/images/thumb/c/c5/Studio-Hybrid_Theory_Cover.jpg/450px-Studio-Hybrid_Theory_Cover.jpg
3,"Judul awal lagu ""In The End"" sebenarnya adalah ""Untitled"". Akan tetapi, Linkin Park memutuskan untuk menggantinya setelah D'Angelo merilis sebuah single berjudul ""Untitled (How Does It Feel)"" pada awal tahun 2000.",https://linkinpedia.com/wiki/In_The_End,https://linkinpedia.com/w/images/thumb/2/25/Single-In_The_End_v1_Cover.jpg/450px-Single-In_The_End_v1_Cover.jpg
4,"Dari sisi musik, lagu ""Heavy is the Crown"" versi serial Netflix ""Arcane"" tercipta lebih dulu sebelum akhirnya berevolusi menjadi versi rock di Album ""From Zero""",https://linkinpedia.com/wiki/Heavy_Is_The_Crown#cite_note-1,https://linkinpedia.com/w/images/thumb/6/6f/Compilation-Arcane_League_of_Legends_Season_2.jpg/450px-Compilation-Arcane_League_of_Legends_Season_2.jpg
5,"Paduan suara pada ""From Zero (Intro)"" muncul kembali di bagian chorus ""The Emptiness Machine""",https://linkinpedia.com/wiki/From_Zero_(Intro)#cite_note-1,https://img.youtube.com/vi/O7r0ALJzahc/maxresdefault.jpg
6,"Dalam lagu ""From Zero (Intro)"", suara yang terdengar mengucapkan kalimat pembuka pada detik ke-10 adalah suara seorang anak, bukan suara Emily.",https://lplive.net/forums/topic/17902-from-zero-listening-party-with-mike/,https://img.youtube.com/vi/3qr6-55oCrM/maxresdefault.jpg
7,"Video musik ""Over Each Other"" direkam di Incheon, Korea Selatan pada 28 September 2024, setelah Linkin Park tampil di kota tersebut.",https://www.youtube.com/watch?v=u_77calN9sQ,https://img.youtube.com/vi/u_77calN9sQ/maxresdefault.jpg
8,"Di bagian akhir lagu ""Overflow"" ada potongan singkat ""Fuse"", sebuah lagu ketika Linkin Park masih bernama Xero",,https://img.youtube.com/vi/qaMxFaIZiKY/maxresdefault.jpg
9,"Lagu Xero yang berjudul ""Fuse"" tidak masuk ke dalam album ""Hybrid Theory (20th Anniversary Edition)"" karena memiliki cuplikan sample audio milik Disney",https://linkinpedia.com/wiki/Fuse,https://linkinpedia.com/w/images/e/ec/Album-Xero_Tape.png
10,"Video musik ""Two Faced"" direkam dua hari sebelum Linkin Park comeback pada tanggal 5 September 2025 di panggung yang sama",https://linkinpedia.com/wiki/Two_Faced,https://img.youtube.com/vi/kivUsDGWojU/maxresdefault.jpg
11,"Urutan proses perekaman instrumen album ""Meteora"" diawali dengan drum, kedua gitar, ketiga bass, keempat scratching DJ, dan yang terakhir vokal.",https://linkinpedia.com/wiki/Meteora#Writing_and_Recording,
12,"Konsep video musik ""Up From the Bottom"" merupakan interpretasi visual dari masing-masing personil Linkin Park ketika mendengarkan lagu tersebut",Transkrip chat Discord Mike 28 Maret 2025,https://i.postimg.cc/5tftbVcg/1f760cbf-762b-4004-80c6-cffafd875062.jpg
13,"""Branch and Arrow"" adalah judul demo dari lagu ""Cut the Bridge""",https://youtu.be/ApR84MzHr6k?si=g3MkAkx1La5hLbTk,https://i.postimg.cc/yNFMFKhR/Inside-the-Studio-for-Cut-The-Bridge-LPTV-FROM-ZERO-Episode-18-Linkin-Park-3-38-screenshot.jpg
14,"Mike menyanyikan bagian chorus di demo ""The Emptiness Machine"" ",https://youtu.be/_G4HV8FYCpc?si=2WQbyBuMtTtX7DX1,https://i.postimg.cc/zvjtBXrz/Inside-the-Studio-for-The-Emptiness-Machine-LPTV-FROM-ZERO-Episode-17-Linkin-Park-1-29-screen.jpg
15,"Menurut Colin, lagu ""Up From the Bottom"" menggambarkan tentang seseorang yang terpenjara oleh pikiran mereka sendiri",https://x.com/thedocbrittain/status/1905424156315042125,https://i.postimg.cc/vBFKBNpm/40125afc3fd98162b005940d38120fc4.jpg
16,"""The Stockroom"" adalah julukan yang diberikan personil Linkin Park untuk studio pribadi Mike Shinoda",https://linkinpedia.com/wiki/Opening,https://i.postimg.cc/d3FgWxBf/Inside-the-Studio-for-Cut-The-Bridge-LPTV-FROM-ZERO-Episode-18-Linkin-Park-0-6-screenshot.jpg
17,"Simbol melingkar seperti dedaunan yang ada pada kover single ""Where'd You Go"" adalah lambang keluarga Mike Shinoda",https://mikeshinoda.tumblr.com/post/42714309094/supernatural-art-show,https://linkinpedia.com/w/images/3/3d/Single-Where%27d_You_Go.jpg